{
  "contribution": { "agent": "Claude (Cowork)", "model": "Claude Opus 5 (claude-opus-5)", "start": "2026-08-06 06:25 UTC", "end": "2026-08-06 06:25 UTC" },
  "$comment": "Decision 0019 implements Decision 0014 gate G5. This is the default Project Uppercut professional ruleset: no three-knockdown rule, no standing eight count, a mandatory count after knockdowns, and no saved-by-the-bell rescue. A bout under these rules ends because a fighter cannot continue, an authorized official stops it, or the cards decide it.",
  "id": "professional",
  "name": "Project Uppercut Professional Rules",
  "version": "1.0.0",
  "mandatory_count_numbers": 8,
  "standing_eight_count": false,
  "three_knockdown_rule": false,
  "knockdowns_per_round_stoppage": null,
  "knockdowns_per_bout_stoppage": null,
  "saved_by_the_bell": false,
  "scoring": {
    "system": "ten_point_must",
    "round_win": 10,
    "round_lose": 9,
    "knockdown_deduction": 1
  },
  "referee_stoppage": {
    "permitted": true,
    "modelled": false,
    "note": "A referee may stop a bout on judgment. This project does not yet model that judgment, so a current bout going the distance must not be mistaken for proof that it could not have been stopped."
  },
  "notes": "Selected as the default by Decision 0014 and implemented by Decision 0019. Pre-ruleset stoppage figures must be rerun rather than reread."
}
